{
  "schema_version": 1,
  "status": "WITHDRAWN_PRIVACY",
  "notice": "Genuine source records and private-evidence fingerprints are withheld from this candidate. An empty public set does not assert that business obligations do not exist. Synthetic fixtures are test-only and are not genuine usage.",
  "records": []
}
